{
	"$schema": "./schemas/event-catalog.schema.json",
	"contract": "ever-works-integrations",
	"contractVersion": "1",
	"catalogVersion": 1,
	"description": "Event catalog v1 (03 Part B.4). One row per event type. `dataSchema` is the JSON Schema of the envelope `data` (null = reserved for a later phase; the type name is fixed but its data schema is published with that phase). `child` marks events about an edge/child row: `aggregate` is the parent with its new version. `optIn` events are excluded from the feed/webhooks unless requested by exact name. Delete/removed events carry the last snapshot plus `deleted: true`.",
	"events": [
		{
			"type": "organization.created",
			"version": 1,
			"domain": "organization",
			"aggregateType": "organization",
			"dataSchema": "schemas/resources/organization.schema.json",
			"phase": "P2"
		},
		{
			"type": "organization.updated",
			"version": 1,
			"domain": "organization",
			"aggregateType": "organization",
			"dataSchema": "schemas/resources/organization.schema.json",
			"phase": "P1"
		},
		{
			"type": "organization.member.added",
			"version": 1,
			"domain": "organization",
			"aggregateType": "organization",
			"dataSchema": "schemas/resources/member.schema.json",
			"phase": "P1",
			"child": "member"
		},
		{
			"type": "organization.member.updated",
			"version": 1,
			"domain": "organization",
			"aggregateType": "organization",
			"dataSchema": "schemas/resources/member.schema.json",
			"phase": "P1",
			"child": "member"
		},
		{
			"type": "organization.member.removed",
			"version": 1,
			"domain": "organization",
			"aggregateType": "organization",
			"dataSchema": "schemas/resources/member.schema.json",
			"phase": "P1",
			"child": "member"
		},
		{
			"type": "agent.created",
			"version": 1,
			"domain": "agents",
			"aggregateType": "agent",
			"dataSchema": "schemas/resources/agent.schema.json",
			"phase": "P1"
		},
		{
			"type": "agent.updated",
			"version": 1,
			"domain": "agents",
			"aggregateType": "agent",
			"dataSchema": "schemas/resources/agent.schema.json",
			"phase": "P1"
		},
		{
			"type": "agent.status_changed",
			"version": 1,
			"domain": "agents",
			"aggregateType": "agent",
			"dataSchema": "schemas/resources/agent.schema.json",
			"phase": "P1"
		},
		{
			"type": "agent.archived",
			"version": 1,
			"domain": "agents",
			"aggregateType": "agent",
			"dataSchema": "schemas/resources/agent.schema.json",
			"phase": "P1"
		},
		{
			"type": "agent.deleted",
			"version": 1,
			"domain": "agents",
			"aggregateType": "agent",
			"dataSchema": "schemas/resources/agent.schema.json",
			"phase": "P1"
		},
		{
			"type": "team.created",
			"version": 1,
			"domain": "teams",
			"aggregateType": "team",
			"dataSchema": "schemas/resources/team.schema.json",
			"phase": "P1"
		},
		{
			"type": "team.updated",
			"version": 1,
			"domain": "teams",
			"aggregateType": "team",
			"dataSchema": "schemas/resources/team.schema.json",
			"phase": "P1"
		},
		{
			"type": "team.deleted",
			"version": 1,
			"domain": "teams",
			"aggregateType": "team",
			"dataSchema": "schemas/resources/team.schema.json",
			"phase": "P1"
		},
		{
			"type": "team.member.added",
			"version": 1,
			"domain": "teams",
			"aggregateType": "team",
			"dataSchema": "schemas/resources/team.schema.json#/$defs/TeamMemberEvent",
			"phase": "P1",
			"child": "member"
		},
		{
			"type": "team.member.updated",
			"version": 1,
			"domain": "teams",
			"aggregateType": "team",
			"dataSchema": "schemas/resources/team.schema.json#/$defs/TeamMemberEvent",
			"phase": "P1",
			"child": "member"
		},
		{
			"type": "team.member.removed",
			"version": 1,
			"domain": "teams",
			"aggregateType": "team",
			"dataSchema": "schemas/resources/team.schema.json#/$defs/TeamMemberEvent",
			"phase": "P1",
			"child": "member"
		},
		{
			"type": "team.resource.added",
			"version": 1,
			"domain": "teams",
			"aggregateType": "team",
			"dataSchema": "schemas/resources/team.schema.json#/$defs/TeamResourceEvent",
			"phase": "P1",
			"child": "resource"
		},
		{
			"type": "team.resource.removed",
			"version": 1,
			"domain": "teams",
			"aggregateType": "team",
			"dataSchema": "schemas/resources/team.schema.json#/$defs/TeamResourceEvent",
			"phase": "P1",
			"child": "resource"
		},
		{
			"type": "work.created",
			"version": 1,
			"domain": "works",
			"aggregateType": "work",
			"dataSchema": "schemas/resources/work.schema.json",
			"phase": "P1"
		},
		{
			"type": "work.updated",
			"version": 1,
			"domain": "works",
			"aggregateType": "work",
			"dataSchema": "schemas/resources/work.schema.json",
			"phase": "P1"
		},
		{
			"type": "work.archived",
			"version": 1,
			"domain": "works",
			"aggregateType": "work",
			"dataSchema": "schemas/resources/work.schema.json",
			"phase": "P1"
		},
		{
			"type": "work.deleted",
			"version": 1,
			"domain": "works",
			"aggregateType": "work",
			"dataSchema": "schemas/resources/work.schema.json",
			"phase": "P1"
		},
		{
			"type": "work.member.added",
			"version": 1,
			"domain": "works",
			"aggregateType": "work",
			"dataSchema": "schemas/resources/work.schema.json#/$defs/WorkMemberEvent",
			"phase": "P1",
			"child": "member"
		},
		{
			"type": "work.member.updated",
			"version": 1,
			"domain": "works",
			"aggregateType": "work",
			"dataSchema": "schemas/resources/work.schema.json#/$defs/WorkMemberEvent",
			"phase": "P1",
			"child": "member"
		},
		{
			"type": "work.member.removed",
			"version": 1,
			"domain": "works",
			"aggregateType": "work",
			"dataSchema": "schemas/resources/work.schema.json#/$defs/WorkMemberEvent",
			"phase": "P1",
			"child": "member"
		},
		{
			"type": "mission.created",
			"version": 1,
			"domain": "missions",
			"aggregateType": "mission",
			"dataSchema": "schemas/resources/mission.schema.json",
			"phase": "P2"
		},
		{
			"type": "mission.updated",
			"version": 1,
			"domain": "missions",
			"aggregateType": "mission",
			"dataSchema": "schemas/resources/mission.schema.json",
			"phase": "P2"
		},
		{
			"type": "mission.status_changed",
			"version": 1,
			"domain": "missions",
			"aggregateType": "mission",
			"dataSchema": "schemas/resources/mission.schema.json",
			"phase": "P2"
		},
		{
			"type": "mission.deleted",
			"version": 1,
			"domain": "missions",
			"aggregateType": "mission",
			"dataSchema": "schemas/resources/mission.schema.json",
			"phase": "P2"
		},
		{
			"type": "mission.goal.linked",
			"version": 1,
			"domain": "missions",
			"aggregateType": "mission",
			"dataSchema": "schemas/resources/mission.schema.json#/$defs/MissionGoalLinkEvent",
			"phase": "P2",
			"child": "goal"
		},
		{
			"type": "mission.goal.unlinked",
			"version": 1,
			"domain": "missions",
			"aggregateType": "mission",
			"dataSchema": "schemas/resources/mission.schema.json#/$defs/MissionGoalLinkEvent",
			"phase": "P2",
			"child": "goal"
		},
		{
			"type": "mission.work.linked",
			"version": 1,
			"domain": "missions",
			"aggregateType": "mission",
			"dataSchema": "schemas/resources/mission.schema.json#/$defs/MissionWorkLinkEvent",
			"phase": "P2",
			"child": "work"
		},
		{
			"type": "mission.work.unlinked",
			"version": 1,
			"domain": "missions",
			"aggregateType": "mission",
			"dataSchema": "schemas/resources/mission.schema.json#/$defs/MissionWorkLinkEvent",
			"phase": "P2",
			"child": "work"
		},
		{
			"type": "goal.created",
			"version": 1,
			"domain": "goals",
			"aggregateType": "goal",
			"dataSchema": "schemas/resources/goal.schema.json",
			"phase": "P2"
		},
		{
			"type": "goal.updated",
			"version": 1,
			"domain": "goals",
			"aggregateType": "goal",
			"dataSchema": "schemas/resources/goal.schema.json",
			"phase": "P2"
		},
		{
			"type": "goal.status_changed",
			"version": 1,
			"domain": "goals",
			"aggregateType": "goal",
			"dataSchema": "schemas/resources/goal.schema.json",
			"phase": "P2"
		},
		{
			"type": "goal.archived",
			"version": 1,
			"domain": "goals",
			"aggregateType": "goal",
			"dataSchema": "schemas/resources/goal.schema.json",
			"phase": "P2"
		},
		{
			"type": "goal.unarchived",
			"version": 1,
			"domain": "goals",
			"aggregateType": "goal",
			"dataSchema": "schemas/resources/goal.schema.json",
			"phase": "P2"
		},
		{
			"type": "goal.deleted",
			"version": 1,
			"domain": "goals",
			"aggregateType": "goal",
			"dataSchema": "schemas/resources/goal.schema.json",
			"phase": "P2"
		},
		{
			"type": "goal.progress_changed",
			"version": 1,
			"domain": "goals",
			"aggregateType": "goal",
			"dataSchema": "schemas/resources/goal.schema.json",
			"phase": "P2",
			"notes": "Throttled to at most 1 per goal per 5 min."
		},
		{
			"type": "idea.created",
			"version": 1,
			"domain": "ideas",
			"aggregateType": "idea",
			"dataSchema": "schemas/resources/idea.schema.json",
			"phase": "P2"
		},
		{
			"type": "idea.updated",
			"version": 1,
			"domain": "ideas",
			"aggregateType": "idea",
			"dataSchema": "schemas/resources/idea.schema.json",
			"phase": "P2"
		},
		{
			"type": "idea.status_changed",
			"version": 1,
			"domain": "ideas",
			"aggregateType": "idea",
			"dataSchema": "schemas/resources/idea.schema.json",
			"phase": "P2"
		},
		{
			"type": "idea.deleted",
			"version": 1,
			"domain": "ideas",
			"aggregateType": "idea",
			"dataSchema": "schemas/resources/idea.schema.json",
			"phase": "P2"
		},
		{
			"type": "task.created",
			"version": 1,
			"domain": "tasks",
			"aggregateType": "task",
			"dataSchema": "schemas/resources/task.schema.json",
			"phase": "P1"
		},
		{
			"type": "task.updated",
			"version": 1,
			"domain": "tasks",
			"aggregateType": "task",
			"dataSchema": "schemas/resources/task.schema.json",
			"phase": "P1"
		},
		{
			"type": "task.transitioned",
			"version": 1,
			"domain": "tasks",
			"aggregateType": "task",
			"dataSchema": "schemas/resources/task.schema.json",
			"phase": "P1"
		},
		{
			"type": "task.deleted",
			"version": 1,